{"type": "object", "additionalProperties": false, "required": ["apiVersion", "root"], "properties": {"ancillaryStyles": {"type": "object", "additionalProperties": false, "properties": {"scrollBar": {"type": "string", "minLength": 1, "maxLength": 128, "pattern": "^[A-Za-z][A-Za-z0-9_-]*\\.[A-Za-z][A-Za-z0-9_.-]*$"}, "popupMenu": {"type": "string", "minLength": 1, "maxLength": 128, "pattern": "^[A-Za-z][A-Za-z0-9_-]*\\.[A-Za-z][A-Za-z0-9_.-]*$"}, "tooltip": {"type": "string", "minLength": 1, "maxLength": 128, "pattern": "^[A-Za-z][A-Za-z0-9_-]*\\.[A-Za-z][A-Za-z0-9_.-]*$"}}}, "apiVersion": {"const": 1}, "root": {"$ref": "#/$defs/node"}, "breakpoints": {"type": "array", "maxItems": 16, "items": {"$ref": "#/$defs/breakpoint"}}}, "$schema": "https://json-schema.org/draft/2020-12/schema", "$id": "urn:uuid:a26f96b8-98c9-4773-a0e3-a17fd295b84f", "x-generatedBy": "Moonwake SkinSchemaRegistry", "x-skinApi": 1, "title": "Moonwake Skin API 1 Layout", "$defs": {"finiteNumber": {"type": "number", "minimum": -100000.0, "maximum": 100000.0}, "length": {"oneOf": [{"type": "number", "minimum": 0.0, "maximum": 100000.0}, {"enum": ["auto"], "type": "string"}, {"type": "string", "minLength": 0, "pattern": "^(?:100(?:\\.0+)?|(?:[0-9]|[1-9][0-9])(?:\\.[0-9]+)?)%$"}]}, "trackLength": {"oneOf": [{"$ref": "#/$defs/length"}, {"type": "string", "minLength": 0, "pattern": "^(?:[1-9][0-9]*(?:\\.[0-9]+)?|0\\.[0-9]*[1-9][0-9]*)fr$"}]}, "inset": {"oneOf": [{"type": "number", "minimum": 0.0, "maximum": 100000.0}, {"type": "object", "additionalProperties": false, "properties": {"top": {"type": "number", "minimum": 0.0, "maximum": 100000.0}, "right": {"type": "number", "minimum": 0.0, "maximum": 100000.0}, "bottom": {"type": "number", "minimum": 0.0, "maximum": 100000.0}, "left": {"type": "number", "minimum": 0.0, "maximum": 100000.0}}}]}, "anchors": {"type": "object", "additionalProperties": false, "properties": {"top": {"$ref": "#/$defs/length"}, "right": {"$ref": "#/$defs/length"}, "bottom": {"$ref": "#/$defs/length"}, "left": {"$ref": "#/$defs/length"}, "centerX": {"type": "number", "minimum": -100000.0, "maximum": 100000.0}, "centerY": {"type": "number", "minimum": -100000.0, "maximum": 100000.0}}}, "row": {"type": "object", "additionalProperties": false, "properties": {"id": {"type": "string", "minLength": 1, "maxLength": 128, "pattern": "^[A-Za-z][A-Za-z0-9_.-]*$"}, "type": {"const": "row"}, "width": {"$ref": "#/$defs/length"}, "height": {"$ref": "#/$defs/length"}, "minWidth": {"type": "number", "minimum": 0.0, "maximum": 100000.0}, "maxWidth": {"type": "number", "minimum": 0.0, "maximum": 100000.0}, "minHeight": {"type": "number", "minimum": 0.0, "maximum": 100000.0}, "maxHeight": {"type": "number", "minimum": 0.0, "maximum": 100000.0}, "margin": {"$ref": "#/$defs/inset"}, "padding": {"$ref": "#/$defs/inset"}, "grow": {"type": "number", "minimum": 0.0, "maximum": 1000.0}, "shrink": {"type": "number", "minimum": 0.0, "maximum": 1000.0}, "alignSelf": {"enum": ["auto", "start", "center", "end", "stretch"]}, "aspectRatio": {"type": "number", "exclusiveMinimum": 0, "maximum": 1000}, "opacity": {"type": "number", "minimum": 0.0, "maximum": 1.0}, "clip": {"type": "boolean"}, "zIndex": {"type": "integer", "minimum": -1000.0, "maximum": 1000.0}, "visible": {"type": "boolean"}, "style": {"type": "string", "minLength": 1, "maxLength": 128, "pattern": "^[A-Za-z][A-Za-z0-9_-]*\\.[A-Za-z][A-Za-z0-9_.-]*$"}, "anchors": {"$ref": "#/$defs/anchors"}, "column": {"type": "integer", "minimum": 1.0, "maximum": 128.0}, "row": {"type": "integer", "minimum": 1.0, "maximum": 128.0}, "columnSpan": {"type": "integer", "minimum": 1.0, "maximum": 128.0}, "rowSpan": {"type": "integer", "minimum": 1.0, "maximum": 128.0}, "gap": {"type": "number", "minimum": 0.0, "maximum": 10000.0}, "align": {"enum": ["start", "center", "end", "stretch"]}, "justify": {"enum": ["start", "center", "end", "spaceBetween", "spaceAround"]}, "children": {"type": "array", "maxItems": 1024, "items": {"$ref": "#/$defs/node"}}}, "required": ["id", "type", "children"]}, "column": {"type": "object", "additionalProperties": false, "properties": {"id": {"type": "string", "minLength": 1, "maxLength": 128, "pattern": "^[A-Za-z][A-Za-z0-9_.-]*$"}, "type": {"const": "column"}, "width": {"$ref": "#/$defs/length"}, "height": {"$ref": "#/$defs/length"}, "minWidth": {"type": "number", "minimum": 0.0, "maximum": 100000.0}, "maxWidth": {"type": "number", "minimum": 0.0, "maximum": 100000.0}, "minHeight": {"type": "number", "minimum": 0.0, "maximum": 100000.0}, "maxHeight": {"type": "number", "minimum": 0.0, "maximum": 100000.0}, "margin": {"$ref": "#/$defs/inset"}, "padding": {"$ref": "#/$defs/inset"}, "grow": {"type": "number", "minimum": 0.0, "maximum": 1000.0}, "shrink": {"type": "number", "minimum": 0.0, "maximum": 1000.0}, "alignSelf": {"enum": ["auto", "start", "center", "end", "stretch"]}, "aspectRatio": {"type": "number", "exclusiveMinimum": 0, "maximum": 1000}, "opacity": {"type": "number", "minimum": 0.0, "maximum": 1.0}, "clip": {"type": "boolean"}, "zIndex": {"type": "integer", "minimum": -1000.0, "maximum": 1000.0}, "visible": {"type": "boolean"}, "style": {"type": "string", "minLength": 1, "maxLength": 128, "pattern": "^[A-Za-z][A-Za-z0-9_-]*\\.[A-Za-z][A-Za-z0-9_.-]*$"}, "anchors": {"$ref": "#/$defs/anchors"}, "column": {"type": "integer", "minimum": 1.0, "maximum": 128.0}, "row": {"type": "integer", "minimum": 1.0, "maximum": 128.0}, "columnSpan": {"type": "integer", "minimum": 1.0, "maximum": 128.0}, "rowSpan": {"type": "integer", "minimum": 1.0, "maximum": 128.0}, "gap": {"type": "number", "minimum": 0.0, "maximum": 10000.0}, "align": {"enum": ["start", "center", "end", "stretch"]}, "justify": {"enum": ["start", "center", "end", "spaceBetween", "spaceAround"]}, "children": {"type": "array", "maxItems": 1024, "items": {"$ref": "#/$defs/node"}}}, "required": ["id", "type", "children"]}, "grid": {"type": "object", "additionalProperties": false, "properties": {"id": {"type": "string", "minLength": 1, "maxLength": 128, "pattern": "^[A-Za-z][A-Za-z0-9_.-]*$"}, "type": {"const": "grid"}, "width": {"$ref": "#/$defs/length"}, "height": {"$ref": "#/$defs/length"}, "minWidth": {"type": "number", "minimum": 0.0, "maximum": 100000.0}, "maxWidth": {"type": "number", "minimum": 0.0, "maximum": 100000.0}, "minHeight": {"type": "number", "minimum": 0.0, "maximum": 100000.0}, "maxHeight": {"type": "number", "minimum": 0.0, "maximum": 100000.0}, "margin": {"$ref": "#/$defs/inset"}, "padding": {"$ref": "#/$defs/inset"}, "grow": {"type": "number", "minimum": 0.0, "maximum": 1000.0}, "shrink": {"type": "number", "minimum": 0.0, "maximum": 1000.0}, "alignSelf": {"enum": ["auto", "start", "center", "end", "stretch"]}, "aspectRatio": {"type": "number", "exclusiveMinimum": 0, "maximum": 1000}, "opacity": {"type": "number", "minimum": 0.0, "maximum": 1.0}, "clip": {"type": "boolean"}, "zIndex": {"type": "integer", "minimum": -1000.0, "maximum": 1000.0}, "visible": {"type": "boolean"}, "style": {"type": "string", "minLength": 1, "maxLength": 128, "pattern": "^[A-Za-z][A-Za-z0-9_-]*\\.[A-Za-z][A-Za-z0-9_.-]*$"}, "anchors": {"$ref": "#/$defs/anchors"}, "column": {"type": "integer", "minimum": 1.0, "maximum": 128.0}, "row": {"type": "integer", "minimum": 1.0, "maximum": 128.0}, "columnSpan": {"type": "integer", "minimum": 1.0, "maximum": 128.0}, "rowSpan": {"type": "integer", "minimum": 1.0, "maximum": 128.0}, "columns": {"type": "array", "minItems": 1, "maxItems": 32, "items": {"$ref": "#/$defs/trackLength"}}, "rows": {"type": "array", "minItems": 1, "maxItems": 32, "items": {"$ref": "#/$defs/trackLength"}}, "columnGap": {"type": "number", "minimum": 0.0, "maximum": 10000.0}, "rowGap": {"type": "number", "minimum": 0.0, "maximum": 10000.0}, "children": {"type": "array", "maxItems": 1024, "items": {"$ref": "#/$defs/node"}}}, "required": ["id", "type", "columns", "rows", "children"]}, "stack": {"type": "object", "additionalProperties": false, "properties": {"id": {"type": "string", "minLength": 1, "maxLength": 128, "pattern": "^[A-Za-z][A-Za-z0-9_.-]*$"}, "type": {"const": "stack"}, "width": {"$ref": "#/$defs/length"}, "height": {"$ref": "#/$defs/length"}, "minWidth": {"type": "number", "minimum": 0.0, "maximum": 100000.0}, "maxWidth": {"type": "number", "minimum": 0.0, "maximum": 100000.0}, "minHeight": {"type": "number", "minimum": 0.0, "maximum": 100000.0}, "maxHeight": {"type": "number", "minimum": 0.0, "maximum": 100000.0}, "margin": {"$ref": "#/$defs/inset"}, "padding": {"$ref": "#/$defs/inset"}, "grow": {"type": "number", "minimum": 0.0, "maximum": 1000.0}, "shrink": {"type": "number", "minimum": 0.0, "maximum": 1000.0}, "alignSelf": {"enum": ["auto", "start", "center", "end", "stretch"]}, "aspectRatio": {"type": "number", "exclusiveMinimum": 0, "maximum": 1000}, "opacity": {"type": "number", "minimum": 0.0, "maximum": 1.0}, "clip": {"type": "boolean"}, "zIndex": {"type": "integer", "minimum": -1000.0, "maximum": 1000.0}, "visible": {"type": "boolean"}, "style": {"type": "string", "minLength": 1, "maxLength": 128, "pattern": "^[A-Za-z][A-Za-z0-9_-]*\\.[A-Za-z][A-Za-z0-9_.-]*$"}, "anchors": {"$ref": "#/$defs/anchors"}, "column": {"type": "integer", "minimum": 1.0, "maximum": 128.0}, "row": {"type": "integer", "minimum": 1.0, "maximum": 128.0}, "columnSpan": {"type": "integer", "minimum": 1.0, "maximum": 128.0}, "rowSpan": {"type": "integer", "minimum": 1.0, "maximum": 128.0}, "children": {"type": "array", "maxItems": 1024, "items": {"$ref": "#/$defs/node"}}}, "required": ["id", "type", "children"]}, "scroll": {"type": "object", "additionalProperties": false, "properties": {"id": {"type": "string", "minLength": 1, "maxLength": 128, "pattern": "^[A-Za-z][A-Za-z0-9_.-]*$"}, "type": {"const": "scroll"}, "width": {"$ref": "#/$defs/length"}, "height": {"$ref": "#/$defs/length"}, "minWidth": {"type": "number", "minimum": 0.0, "maximum": 100000.0}, "maxWidth": {"type": "number", "minimum": 0.0, "maximum": 100000.0}, "minHeight": {"type": "number", "minimum": 0.0, "maximum": 100000.0}, "maxHeight": {"type": "number", "minimum": 0.0, "maximum": 100000.0}, "margin": {"$ref": "#/$defs/inset"}, "padding": {"$ref": "#/$defs/inset"}, "grow": {"type": "number", "minimum": 0.0, "maximum": 1000.0}, "shrink": {"type": "number", "minimum": 0.0, "maximum": 1000.0}, "alignSelf": {"enum": ["auto", "start", "center", "end", "stretch"]}, "aspectRatio": {"type": "number", "exclusiveMinimum": 0, "maximum": 1000}, "opacity": {"type": "number", "minimum": 0.0, "maximum": 1.0}, "clip": {"type": "boolean"}, "zIndex": {"type": "integer", "minimum": -1000.0, "maximum": 1000.0}, "visible": {"type": "boolean"}, "style": {"type": "string", "minLength": 1, "maxLength": 128, "pattern": "^[A-Za-z][A-Za-z0-9_-]*\\.[A-Za-z][A-Za-z0-9_.-]*$"}, "anchors": {"$ref": "#/$defs/anchors"}, "column": {"type": "integer", "minimum": 1.0, "maximum": 128.0}, "row": {"type": "integer", "minimum": 1.0, "maximum": 128.0}, "columnSpan": {"type": "integer", "minimum": 1.0, "maximum": 128.0}, "rowSpan": {"type": "integer", "minimum": 1.0, "maximum": 128.0}, "direction": {"enum": ["vertical", "horizontal"]}, "child": {"$ref": "#/$defs/node"}}, "required": ["id", "type", "direction", "child"]}, "component": {"type": "object", "additionalProperties": false, "properties": {"id": {"type": "string", "minLength": 1, "maxLength": 128, "pattern": "^[A-Za-z][A-Za-z0-9_.-]*$"}, "type": {"const": "component"}, "width": {"$ref": "#/$defs/length"}, "height": {"$ref": "#/$defs/length"}, "minWidth": {"type": "number", "minimum": 0.0, "maximum": 100000.0}, "maxWidth": {"type": "number", "minimum": 0.0, "maximum": 100000.0}, "minHeight": {"type": "number", "minimum": 0.0, "maximum": 100000.0}, "maxHeight": {"type": "number", "minimum": 0.0, "maximum": 100000.0}, "margin": {"$ref": "#/$defs/inset"}, "padding": {"$ref": "#/$defs/inset"}, "grow": {"type": "number", "minimum": 0.0, "maximum": 1000.0}, "shrink": {"type": "number", "minimum": 0.0, "maximum": 1000.0}, "alignSelf": {"enum": ["auto", "start", "center", "end", "stretch"]}, "aspectRatio": {"type": "number", "exclusiveMinimum": 0, "maximum": 1000}, "opacity": {"type": "number", "minimum": 0.0, "maximum": 1.0}, "clip": {"type": "boolean"}, "zIndex": {"type": "integer", "minimum": -1000.0, "maximum": 1000.0}, "visible": {"type": "boolean"}, "style": {"type": "string", "minLength": 1, "maxLength": 128, "pattern": "^[A-Za-z][A-Za-z0-9_-]*\\.[A-Za-z][A-Za-z0-9_.-]*$"}, "anchors": {"$ref": "#/$defs/anchors"}, "column": {"type": "integer", "minimum": 1.0, "maximum": 128.0}, "row": {"type": "integer", "minimum": 1.0, "maximum": 128.0}, "columnSpan": {"type": "integer", "minimum": 1.0, "maximum": 128.0}, "rowSpan": {"type": "integer", "minimum": 1.0, "maximum": 128.0}, "component": {"$ref": "#/$defs/componentId"}, "focusOrder": {"type": "integer", "minimum": 1.0, "maximum": 100000.0}, "presentation": {"enum": ["table", "list", "contain", "cover", "linearHorizontal", "rotary"]}}, "required": ["id", "type", "component"]}, "visual": {"type": "object", "additionalProperties": false, "properties": {"id": {"type": "string", "minLength": 1, "maxLength": 128, "pattern": "^[A-Za-z][A-Za-z0-9_.-]*$"}, "type": {"const": "visual"}, "width": {"$ref": "#/$defs/length"}, "height": {"$ref": "#/$defs/length"}, "minWidth": {"type": "number", "minimum": 0.0, "maximum": 100000.0}, "maxWidth": {"type": "number", "minimum": 0.0, "maximum": 100000.0}, "minHeight": {"type": "number", "minimum": 0.0, "maximum": 100000.0}, "maxHeight": {"type": "number", "minimum": 0.0, "maximum": 100000.0}, "margin": {"$ref": "#/$defs/inset"}, "padding": {"$ref": "#/$defs/inset"}, "grow": {"type": "number", "minimum": 0.0, "maximum": 1000.0}, "shrink": {"type": "number", "minimum": 0.0, "maximum": 1000.0}, "alignSelf": {"enum": ["auto", "start", "center", "end", "stretch"]}, "aspectRatio": {"type": "number", "exclusiveMinimum": 0, "maximum": 1000}, "opacity": {"type": "number", "minimum": 0.0, "maximum": 1.0}, "clip": {"type": "boolean"}, "zIndex": {"type": "integer", "minimum": -1000.0, "maximum": 1000.0}, "visible": {"type": "boolean"}, "style": {"type": "string", "minLength": 1, "maxLength": 128, "pattern": "^[A-Za-z][A-Za-z0-9_-]*\\.[A-Za-z][A-Za-z0-9_.-]*$"}, "anchors": {"$ref": "#/$defs/anchors"}, "column": {"type": "integer", "minimum": 1.0, "maximum": 128.0}, "row": {"type": "integer", "minimum": 1.0, "maximum": 128.0}, "columnSpan": {"type": "integer", "minimum": 1.0, "maximum": 128.0}, "rowSpan": {"type": "integer", "minimum": 1.0, "maximum": 128.0}, "pointerEvents": {"const": "none"}}, "required": ["id", "type", "style"]}, "node": {"oneOf": [{"$ref": "#/$defs/row"}, {"$ref": "#/$defs/column"}, {"$ref": "#/$defs/grid"}, {"$ref": "#/$defs/stack"}, {"$ref": "#/$defs/scroll"}, {"$ref": "#/$defs/component"}, {"$ref": "#/$defs/visual"}]}, "breakpoint": {"type": "object", "additionalProperties": false, "required": ["when", "root"], "properties": {"ancillaryStyles": {"type": "object", "additionalProperties": false, "properties": {"scrollBar": {"type": "string", "minLength": 1, "maxLength": 128, "pattern": "^[A-Za-z][A-Za-z0-9_-]*\\.[A-Za-z][A-Za-z0-9_.-]*$"}, "popupMenu": {"type": "string", "minLength": 1, "maxLength": 128, "pattern": "^[A-Za-z][A-Za-z0-9_-]*\\.[A-Za-z][A-Za-z0-9_.-]*$"}, "tooltip": {"type": "string", "minLength": 1, "maxLength": 128, "pattern": "^[A-Za-z][A-Za-z0-9_-]*\\.[A-Za-z][A-Za-z0-9_.-]*$"}}}, "when": {"type": "object", "additionalProperties": false, "properties": {"minWidth": {"type": "number", "minimum": 0.0, "maximum": 100000.0}, "maxWidth": {"type": "number", "minimum": 0.0, "maximum": 100000.0}, "minHeight": {"type": "number", "minimum": 0.0, "maximum": 100000.0}, "maxHeight": {"type": "number", "minimum": 0.0, "maximum": 100000.0}, "minScaleFactor": {"type": "number", "exclusiveMinimum": 0, "maximum": 8}, "maxScaleFactor": {"type": "number", "exclusiveMinimum": 0, "maximum": 8}, "workspace": {"enum": ["studio", "listening"]}}, "minProperties": 1}, "root": {"$ref": "#/$defs/node"}}}, "componentId": {"enum": ["app.brand.eyebrow", "app.brand.title", "app.deviceStatus", "app.status", "workspace.studio", "workspace.listening", "settings.open", "library.add", "library.search", "queue.title", "queue.count", "queue.table", "queue.empty", "queue.remove", "queue.clear", "queue.moveUp", "queue.moveDown", "artwork.cover", "artwork.metadata", "nowPlaying.eyebrow", "nowPlaying.title", "nowPlaying.metadata", "transport.previous", "transport.playPause", "transport.next", "transport.seek", "transport.time", "transport.shuffle", "transport.repeat", "transport.repeatCycle", "transport.volumeLabel", "transport.volumeValue", "transport.volume", "effects.open", "effects.close", "effects.summary", "effects.title", "effects.filterLabel", "effects.filter", "effects.typeFilter", "effects.manufacturerFilter", "effects.formatFilter", "effects.catalog", "effects.scope", "effects.scopeLabel", "effects.add", "effects.chain", "effects.empty", "effects.outputLayout", "output.stage", "output.mixer", "output.mode", "output.reset", "settings.title", "settings.close", "settings.audio.heading", "settings.audio.device", "settings.audio.deviceConfiguration", "settings.audio.sampleRate", "settings.audio.bufferSize", "settings.audio.channelLayout", "settings.audio.channelMap", "settings.audio.routing", "settings.plugins.formats", "settings.plugins.enableVst3", "settings.plugins.enableAu", "settings.plugins.filter", "settings.plugins.typeFilter", "settings.plugins.manufacturerFilter", "settings.plugins.formatFilter", "settings.plugins.knownList", "settings.plugins.scanAll", "settings.plugins.scanFolder", "settings.plugins.cancel", "settings.plugins.progress", "settings.plugins.scanScope", "settings.plugins.defaultLocations", "settings.plugins.customDirectories", "settings.plugins.removeDirectory", "settings.skins.heading", "settings.skins.library", "settings.skins.import", "settings.skins.remove", "settings.skins.preview", "settings.skins.apply", "settings.skins.cancelPreview", "settings.skins.reload"]}}}
